{
  "schema_version": "1.2",
  "generated_at": "{{GENERATED_AT}}",
  "project": "replace-me",
  "subject": {
    "revision": "[commit, content hash, or immutable version]",
    "artifact_ref": "[build, deployment, or workspace reference]",
    "environment": "[exact local, CI, preview, staging, production, experiment, or other target]",
    "environment_class": "LOCAL"
  },
  "mode": "AUTONOMOUS_BUILD",
  "delivery_target": "PRODUCTION_LIVE",
  "claim": "PARTIAL",
  "material_release": true,
  "change_profiles": ["USER_FACING"],
  "independent_review_level": "NOT_RUN",
  "independent_review_verdict": "NOT_RUN",
  "required_categories": ["accessibility", "build", "critical_journey", "independent_review", "ui_runtime"],
  "external_blockers": [],
  "requirements_snapshot": {
    "source_ref": "[authoritative project or intake path]",
    "source_revision": "[commit, content hash, or immutable version]",
    "non_negotiable_ids": []
  },
  "protected_requirements": [],
  "open_findings": [],
  "gates": [
    {"id": "build", "category": "build", "required": true, "status": "NOT_RUN", "evidence": [], "rationale": ""},
    {"id": "critical-journey", "category": "critical_journey", "required": true, "status": "NOT_RUN", "evidence": [], "rationale": ""},
    {"id": "ui-runtime", "category": "ui_runtime", "required": true, "status": "NOT_RUN", "evidence": [], "rationale": ""},
    {"id": "accessibility", "category": "accessibility", "required": true, "status": "NOT_RUN", "evidence": [], "rationale": ""},
    {"id": "independent-review", "category": "independent_review", "required": true, "status": "NOT_RUN", "evidence": [], "rationale": ""}
  ]
}
